{
  "id": "chabad-letter-4666317",
  "title": "אגרות קודש - מכתב רעח",
  "source_class": "Igrot Kodesh",
  "pipeline_status": "Verified",
  "date_original": null,
  "date_precision": "unknown",
  "language": "Hebrew/Yiddish",
  "context_status": "partial",
  "summary_researcher": null,
  "provenance": {
    "authorship_status": "attributed to Rabbi Menachem M. Schneerson by authorized publisher",
    "signature_status": null,
    "source_witness": "authorized Kehot/Chabad.org item-level publisher page",
    "transmission_type": "published edition",
    "textual_status": "publisher transcription/edition",
    "editorial_scope": "Kehot Publication Society edition presented on Chabad.org",
    "verification_status": "Verified",
    "source_url": "https://www.chabad.org/therebbe/article_cdo/aid/4666317/jewish/page.htm",
    "accessed": "2026-09-27"
  },
  "witness": {
    "kind": "text",
    "state": "authorized publisher witness",
    "complete_partial": "partial",
    "notes": "Item-level page checked directly. Underlying manuscript/secretariat copy not independently inspected; incoming correspondence/context may be absent."
  },
  "access": {
    "access_level": "open",
    "rights_status": "copyrighted-link-only",
    "reuse_notes": "Store metadata and link; do not bulk-copy protected full text."
  },
  "relations": [],
  "taxonomy": {
    "publisher_index_terms": [
      "אגרות קודש",
      "כרך ב"
    ],
    "research_terms": [],
    "response_case_candidate": true
  },
  "epistemic_level": 1,
  "notes": "Verified is scoped to the authorized item-level publisher witness, not to an independently inspected manuscript."
}