{
  "id": "chabad-letter-4666319",
  "title": "Igrot Kodesh volume 2 item 4666319",
  "source_class": "Igrot Kodesh",
  "pipeline_status": "Verified",
  "date_original": null,
  "date_precision": "unknown",
  "language": "Hebrew/Yiddish",
  "context_status": "partial",
  "summary_researcher": null,
  "provenance": {
    "authorship_status": "publisher attribution to Rabbi Menachem M. Schneerson",
    "signature_status": null,
    "source_witness": "authorized Kehot/Chabad.org item-level publisher page",
    "transmission_type": "published edition",
    "textual_status": "publisher edition",
    "editorial_scope": "Kehot edition on Chabad.org",
    "verification_status": "Verified",
    "source_url": "https://www.chabad.org/therebbe/article_cdo/aid/4666319/jewish/page.htm",
    "accessed": "2026-09-27"
  },
  "witness": {
    "kind": "text",
    "state": "authorized publisher witness",
    "complete_partial": "partial",
    "notes": "Item-level page checked directly; underlying manuscript not independently inspected."
  },
  "access": {
    "access_level": "open",
    "rights_status": "copyrighted-link-only",
    "reuse_notes": "Metadata and link only."
  },
  "relations": [],
  "taxonomy": {
    "publisher_index_terms": [
      "Igrot Kodesh",
      "Volume 2"
    ],
    "research_terms": [],
    "response_case_candidate": true
  },
  "epistemic_level": 1,
  "notes": "Verified scope is the authorized item-level publisher witness."
}