{"id":"igrot-kodesh-v1-letter-166-aid-4646128","title":"אגרות קודש - כרך א - מכתב קסו","source_class":"Igrot Kodesh","pipeline_status":"Verified","date_original":"י\"ד מנחם אב תש\"ד","date_precision":"exact","language":"Hebrew/Yiddish","context_status":"partial","summary_researcher":"Authorized Kehot/Chabad.org item-level witness for Igrot Kodesh volume 1, letter 166; publisher page explicitly refers to a delayed response to the recipient's letter.","provenance":{"authorship_status":"publisher-attributed to Rabbi Menachem M. Schneerson","source_witness":"Kehot/Chabad.org item-level published letter page, aid 4646128","transmission_type":"published letter","editorial_scope":"item-level page","verification_status":"verified_against_direct_authorized_publisher_item_witness_2026-09-24","verification_scope":"stable publisher URL/aid, letter number, displayed date and response framing","source_url":"https://www.chabad.org/therebbe/article_cdo/aid/4646128/jewish/page.htm","accessed":"2026-09-24"},"witness":{"kind":"text","state":"authorized published item witness","complete_partial":"unknown","notes":"Incoming letter and underlying physical witness not independently inspected."},"access":{"access_level":"open","rights_status":"copyrighted-link-only","reuse_notes":"Metadata and research summary only; protected full text not stored."},"relations":[],"taxonomy":{"publisher_index_terms":[],"research_terms":["correspondence","response"],"response_case_candidate":true},"epistemic_level":1,"notes":"Verified scope is item-level publisher witness only; context remains partial."}