{
  "id":"igrot-kodesh-v2-letter-193-aid-4666232",
  "title":"אגרות קודש — מכתב קצג",
  "source_class":"Igrot Kodesh",
  "pipeline_status":"Verified",
  "date_original":"ח׳ אלול תש״ה",
  "date_precision":"exact",
  "language":"Hebrew",
  "context_status":"partial",
  "summary_researcher":"מכתב מתוארך ח׳ אלול תש״ה שנבדק בדף הפריט המוסמך. קשרים מאוחרים אליו נשמרים כקישורים עריכתיים בלבד כאשר המו״ל מפנה אליו.",
  "provenance":{"authorship_status":"published as correspondence of the Rebbe by Kehot","signature_status":"unknown from web edition","source_witness":"authorized Kehot/Chabad.org item page","transmission_type":"published edition","textual_status":"publisher item checked at item level","editorial_scope":"publisher edition","verification_status":"Verified against direct authorized publisher item witness","source_url":"https://www.chabad.org/torah-texts/4666232","accessed":"2026-09-22"},
  "witness":{"kind":"text","state":"published authorized item witness","complete_partial":"unknown","notes":"No claim is made that an underlying manuscript or secretariat copy was independently inspected."},
  "access":{"access_level":"open","rights_status":"copyrighted-link-only","reuse_notes":"Metadata and research summary only; protected full text is not copied."},
  "relations":[],
  "taxonomy":{"publisher_index_terms":["כרך ב","מכתב קצג"],"research_terms":["published correspondence"],"response_case_candidate":false},
  "epistemic_level":1,
  "notes":"Direct publisher item witness confirms item identity and date. Later publisher pages (e.g. letter 209) explicitly cross-reference letter 193; those links should be modeled separately as editorial_cross_reference, not as same-evidence-family unless corroborated. Initial dedup key: aid 4666232 + letter 193 + stable URL."
}