{"id":"living-torah-aid-1775208","title":"Home is Where the Heart Is","source_class":"Video","pipeline_status":"Indexed","date_original":"5 Cheshvan 5752 / October 13, 1991","date_precision":"exact","language":null,"context_status":"partial","summary_researcher":"Stable Living Torah item-level player record; audiovisual content remains unverified.","provenance":{"authorship_status":"Rebbe audiovisual segment per publisher metadata","signature_status":null,"source_witness":"JEM/Living Torah published video player","transmission_type":"audiovisual excerpt","textual_status":"publisher metadata/summary only","editorial_scope":"Living Torah edited segment","verification_status":"metadata-checked; audiovisual-witness-unverified","source_url":"https://www.chabad.org/therebbe/livingtorah/player_cdo/aid/1775208/jewish/Home-is-Where-the-Heart-Is.htm","accessed":"2026-09-18"},"witness":{"kind":"recording","state":"public player page located; media not independently reviewed","complete_partial":"partial","notes":"Disc 98, Program 390; aid 1775208."},"access":{"access_level":"metadata-only","rights_status":"copyrighted-link-only","reuse_notes":"Metadata and locator indexed only."},"relations":[],"taxonomy":{"publisher_index_terms":[],"research_terms":["israel","diaspora","thought","spiritual-influence"],"response_case_candidate":true},"epistemic_level":1,"notes":"Indexed does not mean Verified."}