{
  "id": "sichos-kodesh-audio-aid-550454",
  "title": "19 Kislev 5714 - Maamar",
  "source_class": "Audio",
  "pipeline_status": "Indexed",
  "date_original": "19 Kislev 5714 / 1953-11-26",
  "date_precision": "exact",
  "language": null,
  "context_status": "unknown",
  "summary_researcher": "Publisher-listed audio manifestation from the 19 Kislev 5714 event cluster. Content, completeness and textual equivalence remain unverified.",
  "provenance": {
    "authorship_status": "publisher_attributes_public_address_to_the_Rebbe",
    "signature_status": null,
    "source_witness": "recording manifestation listed by Jewish Educational Media",
    "transmission_type": "audio",
    "textual_status": null,
    "editorial_scope": "publisher item metadata",
    "verification_status": "canonical_metadata_checked_direct_component_page_and_event_page_content_not_verified",
    "source_url": "https://www.chabad.org/therebbe/article_cdo/aid/550454/jewish/19-Kislev-5714-Maamar.htm",
    "accessed": "2026-09-20"
  },
  "witness": {
    "kind": "recording",
    "state": "publisher-listed audio manifestation",
    "complete_partial": "unknown",
    "notes": "Direct component page and event-cluster metadata checked. Related-text linkage requires exact target locator before canonical relation is asserted."
  },
  "access": {
    "access_level": "metadata-only",
    "rights_status": "copyrighted-link-only",
    "reuse_notes": "Metadata and stable locator retained; audio/transcript not copied."
  },
  "relations": [],
  "taxonomy": {
    "publisher_index_terms": ["Sichos Kodesh Audio", "Maamar"],
    "research_terms": ["19 Kislev 5714", "audio witness"],
    "response_case_candidate": false
  },
  "epistemic_level": 1,
  "notes": "Promoted from staging after direct item-level locator check. Indexed is not Verified. Duration 40:20 is publisher event metadata."
}