{
  "id": "igrot-kodesh-v2-letter-249-aid-4666288",
  "title": "אגרות קודש — מכתב רמט",
  "source_class": "Igrot Kodesh",
  "pipeline_status": "Verified",
  "date_original": null,
  "date_precision": "unknown",
  "language": "Hebrew/Yiddish as published",
  "context_status": "partial",
  "summary_researcher": null,
  "provenance": {
    "authorship_status": "published as correspondence of the Rebbe by Kehot",
    "signature_status": "publisher item page inspected",
    "source_witness": "authorized Kehot/Chabad.org item page",
    "transmission_type": "published edition",
    "textual_status": "item-level publisher witness checked; no missing context reconstructed",
    "editorial_scope": "item-level page",
    "verification_status": "Verified against direct authorized publisher item witness on 2026-09-27",
    "source_url": "https://www.chabad.org/therebbe/article_cdo/aid/4666288/jewish/page.htm",
    "accessed": "2026-09-27"
  },
  "access": {
    "access_level": "open",
    "rights_status": "copyrighted-link-only",
    "reuse_notes": "Metadata and locator only; protected full text is not stored."
  },
  "epistemic_level": 1,
  "notes": "Direct item-level publisher witness inspected; date/content enrichment deferred rather than inferred."
}