{
  "id":"igrot-kodesh-v2-letter-191-aid-4666230",
  "title":"אגרות קודש — מכתב קצא",
  "source_class":"Igrot Kodesh",
  "pipeline_status":"Verified",
  "date_original":"כ״א מנחם אב תש״ה",
  "date_precision":"exact",
  "language":"Hebrew",
  "context_status":"partial",
  "summary_researcher":"מכתב המתואר במקור עצמו כמענה על מכתבים קודמים; המכתבים הנכנסים אינם חלק מן ה-witness שנבדק ולכן ההקשר נשאר חלקי.",
  "provenance":{"authorship_status":"published as correspondence of the Rebbe by Kehot","signature_status":"unknown from web edition","source_witness":"authorized Kehot/Chabad.org item page","transmission_type":"published edition","textual_status":"publisher text checked at item level","editorial_scope":"page includes editorial cross-references","verification_status":"Verified against direct authorized publisher item witness","source_url":"https://www.chabad.org/therebbe/article_cdo/aid/4666230/jewish/page.htm","accessed":"2026-09-22"},
  "witness":{"kind":"text","state":"published authorized item witness","complete_partial":"unknown","notes":"Verification is of the authorized published item page, not a physical manuscript/secretariat witness."},
  "access":{"access_level":"open","rights_status":"copyrighted-link-only","reuse_notes":"Store metadata, locator and research summary; do not bulk reproduce protected text."},
  "relations":[{"type":"editorial_cross_reference","target_id":"igrot-kodesh-v2-letter-179-aid-4666218","basis":"Publisher notes identify additional correspondence to the same addressee, including letter 179."}],
  "taxonomy":{"publisher_index_terms":["כרך ב","מכתב קצא"],"research_terms":["response correspondence","incoming letter missing"],"response_case_candidate":true},
  "epistemic_level":1,
  "notes":"Direct item witness confirms identity, date and response framing. No incoming correspondence was supplied; no missing question/context is inferred. Initial dedup key: aid 4666230 + letter 191 + stable URL."
}