{
  "id": "torat-menachem-5742-17-tammuz",
  "title": "י״ז תמוז, ה׳תשמ״ב",
  "source_class": "Torat Menachem",
  "pipeline_status": "Indexed",
  "date_original": "י״ז תמוז ה׳תשמ״ב",
  "date_precision": "exact",
  "language": "he",
  "context_status": "unknown",
  "summary_researcher": null,
  "provenance": {
    "authorship_status": "Published within the Torat Menachem series page attributed to the Rebbe",
    "signature_status": null,
    "source_witness": "Chabad.org published item page / Torat Menachem edition",
    "transmission_type": "published edition web rendering",
    "textual_status": "not yet classified",
    "editorial_scope": "Vaad Hanachos B'Lahak series context stated on page",
    "verification_status": "metadata checked; content/witness not yet verified item-level",
    "source_url": "https://he.chabad.org/library/article_cdo/aid/5996765",
    "accessed": "2026-09-17"
  },
  "witness": {
    "kind": "text",
    "state": "published web edition",
    "complete_partial": "unknown",
    "notes": "Do not infer completeness from the web rendering until textual witness is checked."
  },
  "access": {
    "access_level": "open",
    "rights_status": "copyrighted-link-only",
    "reuse_notes": "Index metadata and link; do not bulk reproduce protected text."
  },
  "relations": [],
  "taxonomy": {
    "publisher_index_terms": [],
    "research_terms": [],
    "response_case_candidate": false
  },
  "notes": "Seed item-level record created to establish evidence-backed migration from corpus metadata to document-level indexing."
}