{
  "id": "sichos-kodesh-audio-aid-550456",
  "title": "19 Kislev 5714 - Sicha 3",
  "source_class": "Audio",
  "pipeline_status": "Indexed",
  "date_original": "19 Kislev 5714 / 1953-11-26",
  "date_precision": "exact",
  "language": null,
  "context_status": "unknown",
  "summary_researcher": "Publisher-listed audio manifestation from the 19 Kislev 5714 event cluster. Content and recording completeness have not been verified.",
  "provenance": {
    "authorship_status": "publisher_attributes_public_address_to_the_Rebbe",
    "signature_status": null,
    "source_witness": "recording manifestation listed by Jewish Educational Media",
    "transmission_type": "audio",
    "textual_status": null,
    "editorial_scope": "publisher item metadata",
    "verification_status": "canonical_metadata_checked_direct_component_page_content_not_verified",
    "source_url": "https://www.chabad.org/therebbe/article_cdo/aid/550456/jewish/19-Kislev-5714-Sicha-3.htm",
    "accessed": "2026-09-20"
  },
  "witness": {
    "kind": "recording",
    "state": "publisher-listed audio manifestation",
    "complete_partial": "unknown",
    "notes": "Direct component page checked; no claim about completeness or equivalence to printed witnesses."
  },
  "access": {
    "access_level": "metadata-only",
    "rights_status": "copyrighted-link-only",
    "reuse_notes": "Metadata and stable locator retained; audio/transcript not copied."
  },
  "relations": [],
  "taxonomy": {
    "publisher_index_terms": ["Sichos Kodesh Audio", "Sicha"],
    "research_terms": ["19 Kislev 5714", "audio witness"],
    "response_case_candidate": false
  },
  "epistemic_level": 1,
  "notes": "Promoted after direct item-level locator check. Indexed is not Verified. Publisher section metadata gives duration 7:46."
}