{
  "id": "igrot-kodesh-vol3-p372-livelihood-minyan",
  "title": "אגרות קודש ח״ג עמ׳ שעב — שאלת עבודה במקום ללא מניין",
  "source_class": "Igrot Kodesh",
  "pipeline_status": "Indexed",
  "date_original": null,
  "date_precision": "unknown",
  "language": null,
  "context_status": "partial",
  "summary_researcher": "A Chabad.org secondary presentation explicitly cites Igrot Kodesh vol. 3 p. 372 and describes the initiating question as whether the correspondent should return for work to a city without a minyan. This creates a documented response-case candidate at the intersection of livelihood and religious-observance constraints. The incoming letter itself and the original published page have not yet been independently inspected in this repository.",
  "provenance": {
    "authorship_status": "attributed to the Rebbe via explicit Igrot Kodesh citation",
    "signature_status": null,
    "source_witness": "Chabad.org article quoting/citing Igrot Kodesh vol. 3 p. 372",
    "transmission_type": "Igrot Kodesh → Chabad.org secondary presentation",
    "textual_status": "secondary quotation/reference; original edition page not yet inspected",
    "editorial_scope": "secondary educational presentation",
    "verification_status": "citation and initiating-question description checked on Chabad.org; primary printed witness pending",
    "source_url": "https://www.chabad.org/library/article_cdo/aid/5478256/jewish/Introduction-Part-10-Harm-Free-Employment.htm",
    "accessed": "2026-09-17"
  },
  "witness": {
    "kind": "text",
    "state": "secondary witness with precise volume/page citation",
    "complete_partial": "partial",
    "notes": "Do not infer the correspondent's identity, city, employment terms, or full wording of the incoming question."
  },
  "access": {
    "access_level": "open",
    "rights_status": "copyrighted-link-only",
    "reuse_notes": "Store metadata and research summary; do not reproduce protected text beyond permitted quotation."
  },
  "relations": [],
  "taxonomy": {
    "publisher_index_terms": ["livelihood", "minyan"],
    "research_terms": ["livelihood decision", "religious-observance constraint", "employment location", "decision under material pressure"],
    "response_case_candidate": true
  },
  "epistemic_level": 1,
  "notes": "Priority follow-up: locate the authoritative Igrot Kodesh page/item and exact date/recipient metadata before promotion beyond Indexed."
}