{"id":"igrot-kodesh-v2-letter-176-aid4666215","title":"אגרות קודש - כרך ב - מכתב קעו","source_class":"Igrot Kodesh","pipeline_status":"Verified","date_original":"ח׳ טבת, תש״ה","date_precision":"exact","language":"Hebrew","context_status":"partial","summary_researcher":"Published response to a Chanukah letter, structured around requested comments on a copied halakhic inquiry.","provenance":{"authorship_status":"publisher-attributed-to-Rebbe","signature_status":"published signature line","source_witness":"authorized Kehot/Chabad.org published item; publisher note says completed from photograph of the letter","transmission_type":"published letter completed from photograph","textual_status":"published edition; underlying photograph not independently inspected","editorial_scope":"publisher cross-references preserved separately","verification_status":"verified-against-authorized-publisher-item-2026-09-21","source_url":"https://www.chabad.org/therebbe/article_cdo/aid/4666215/jewish/page.htm","accessed":"2026-09-21"},"witness":{"kind":"text","state":"authorized published witness; underlying photograph not inspected","complete_partial":"partial","notes":"Publisher explicitly says the text was completed from a photograph of the letter."},"access":{"access_level":"open","rights_status":"copyrighted-link-only","reuse_notes":"Metadata and research summary only."},"relations":[{"type":"editorial_cross_reference","target_id":"igrot-kodesh-v1-letter-132","basis":"Publisher note explicitly points to volume 1 letter קלב on the same halakhic issue."}],"taxonomy":{"publisher_index_terms":["אגרות קודש","כרך ב","קעו"],"research_terms":["response case","halakhic correspondence"],"response_case_candidate":true},"epistemic_level":1,"notes":"Dedup checked by stable aid, URL, volume and letter identifier; no duplicate found."}